{
  "system_name": "AWS ECS Fullstack App (Terraform Demo)",
  "description": "MIT-0 AWS sample: a Vue.js SPA (client) and a Node.js/Express API (server) run as separate ECS Fargate services behind two internet-facing Application Load Balancers in a single VPC, provisioned entirely by Terraform. A GitHub-triggered CodePipeline (CodeBuild + CodeDeploy blue/green) builds Docker images to ECR and deploys to ECS. The API returns a product catalog from a DynamoDB table; images are served from an S3 bucket. Both ALBs (including the backend/API ALB) are public and HTTP-only; the app has no authentication or authorization.",
  "detected_pattern": "web-app",
  "roles": [
    { "id": "R0", "name": "anonymous (unauthenticated Internet user)" },
    { "id": "R1", "name": "ECS task execution role (ECS-task-excecution-Role)" },
    { "id": "R2", "name": "ECS task role (ECS-task-Role)" },
    { "id": "R3", "name": "DevOps role (CodeBuild/CodeDeploy/CodePipeline)" },
    { "id": "R4", "name": "CodeDeploy role" },
    { "id": "R5", "name": "Terraform operator / deployer (human with AWS credentials + GitHub PAT)" }
  ],
  "components": [
    { "id": "C1", "name": "Client SPA (Vue.js served by Nginx)", "tech": "Vue.js 2, bootstrap-vue, axios, Nginx", "evidence": ["Code/client/src/main.js", "Code/client/Dockerfile", "Code/client/src/router/index.js"] },
    { "id": "C2", "name": "Server API (Node.js/Express)", "tech": "Node.js, Express 4, aws-sdk v2, cors", "evidence": ["Code/server/src/app.js", "Code/server/package.json", "Code/server/Dockerfile"] },
    { "id": "C3", "name": "Swagger / API docs endpoint", "tech": "swagger-jsdoc, swagger-ui-express", "evidence": ["Code/server/src/swagger/swagger.js", "Code/server/src/app.js:13"] },
    { "id": "C4", "name": "Client ALB (internet-facing, HTTP:80)", "tech": "AWS Application Load Balancer", "evidence": ["Infrastructure/main.tf:120", "Infrastructure/Modules/ALB/main.tf:8", "Infrastructure/Modules/ALB/main.tf:38"] },
    { "id": "C5", "name": "Server/API ALB (internet-facing, HTTP:80)", "tech": "AWS Application Load Balancer", "evidence": ["Infrastructure/main.tf:110", "Infrastructure/Modules/ALB/main.tf:8", "Infrastructure/Modules/ALB/main.tf:38"] },
    { "id": "C6", "name": "ECS Cluster (Fargate)", "tech": "Amazon ECS on Fargate", "evidence": ["Infrastructure/Modules/ECS/Cluster/main.tf:8", "Infrastructure/main.tf:206"] },
    { "id": "C7", "name": "ECS Service - client task", "tech": "ECS Fargate service, awsvpc, private subnets", "evidence": ["Infrastructure/main.tf:227", "Infrastructure/Modules/ECS/Service/main.tf:8"] },
    { "id": "C8", "name": "ECS Service - server task", "tech": "ECS Fargate service, awsvpc, private subnets", "evidence": ["Infrastructure/main.tf:212", "Infrastructure/Modules/ECS/Service/main.tf:8"] },
    { "id": "C9", "name": "CodePipeline (Source/Build/Deploy)", "tech": "AWS CodePipeline, GitHub v1 source", "evidence": ["Infrastructure/Modules/CodePipeline/main.tf:8", "Infrastructure/main.tf:362"] },
    { "id": "C10", "name": "CodeBuild projects (server + client)", "tech": "AWS CodeBuild, standard:4.0, privileged_mode", "evidence": ["Infrastructure/Modules/CodeBuild/main.tf:8", "Infrastructure/Templates/buildspec.yml"] },
    { "id": "C11", "name": "CodeDeploy applications (blue/green ECS)", "tech": "AWS CodeDeploy CodeDeployDefault.ECSAllAtOnce", "evidence": ["Infrastructure/Modules/CodeDeploy/main.tf:9", "Infrastructure/Templates/appspec.yaml"] },
    { "id": "C12", "name": "ECS Autoscaling + CloudWatch alarms", "tech": "Application Auto Scaling (CPU/memory target tracking)", "evidence": ["Infrastructure/Modules/ECS/Autoscaling/main.tf"] },
    { "id": "C13", "name": "SNS deployment-notifications topic", "tech": "Amazon SNS", "evidence": ["Infrastructure/Modules/SNS/main.tf:8", "Infrastructure/Modules/CodeDeploy/main.tf:65"] }
  ],
  "data_stores": [
    { "id": "D1", "name": "DynamoDB products/assets table", "tech": "Amazon DynamoDB, PAY_PER_REQUEST, hash_key=id(N)", "evidence": ["Infrastructure/Modules/Dynamodb/main.tf:8", "Infrastructure/Modules/Dynamodb/variables.tf", "Code/server/src/app.js:47"] },
    { "id": "D2", "name": "S3 assets bucket (app images)", "tech": "Amazon S3, acl=private, force_destroy=true", "evidence": ["Infrastructure/main.tf:382", "Infrastructure/Modules/S3/main.tf:8"] },
    { "id": "D3", "name": "S3 CodePipeline artifact bucket", "tech": "Amazon S3, acl=private, force_destroy=true", "evidence": ["Infrastructure/main.tf:264", "Infrastructure/Modules/CodePipeline/main.tf:12"] },
    { "id": "D4", "name": "ECR repositories (server + client images)", "tech": "Amazon ECR, image_tag_mutability=MUTABLE, no scan-on-push", "evidence": ["Infrastructure/Modules/ECR/main.tf:8", "Infrastructure/main.tf:147"] },
    { "id": "D5", "name": "CloudWatch Logs (ECS task + CodeBuild logs)", "tech": "CloudWatch Logs, awslogs driver, 30-day retention", "evidence": ["Infrastructure/Modules/ECS/TaskDefinition/main.tf:45", "Infrastructure/Templates/taskdef.json:8", "Infrastructure/Modules/CodeBuild/main.tf:85"] },
    { "id": "D6", "name": "Terraform state (local, contains github_token)", "tech": "Local terraform.tfstate on operator machine", "evidence": ["README.md:37", ".gitignore"] }
  ],
  "entry_points": [
    { "id": "E1", "name": "Client ALB HTTP :80 from 0.0.0.0/0 (SPA)", "tech": "HTTP, no auth, open to Internet", "evidence": ["Infrastructure/main.tf:100", "Infrastructure/main.tf:38", "Infrastructure/Modules/ALB/main.tf:38"] },
    { "id": "E2", "name": "Server/API ALB HTTP :80 from 0.0.0.0/0 (/api/getAllProducts, /status)", "tech": "HTTP, no auth, open to Internet", "evidence": ["Infrastructure/main.tf:90", "Code/server/src/app.js:47", "Code/client/src/services/RestServices.js:6"] },
    { "id": "E3", "name": "Swagger UI /api/docs (publicly reachable via server ALB)", "tech": "HTTP, swagger-ui-express, no auth", "evidence": ["Code/server/src/swagger/swagger.js:42", "Infrastructure/outputs.tf:9"] },
    { "id": "E4", "name": "GitHub source trigger (CodePipeline PollForSourceChanges)", "tech": "GitHub v1 source action, OAuth token, poll", "evidence": ["Infrastructure/Modules/CodePipeline/main.tf:20", "Infrastructure/Modules/CodePipeline/main.tf:33"] },
    { "id": "E5", "name": "ALB → task health check (/status, /)", "tech": "HTTP health check from ALB target group", "evidence": ["Infrastructure/main.tf:46", "Infrastructure/Modules/ALB/main.tf:65"] }
  ],
  "trust_boundaries": [
    { "id": "TB1", "name": "Internet → public ALBs (0.0.0.0/0 :80 HTTP)", "kind": "network", "evidence": ["Infrastructure/main.tf:95", "Infrastructure/main.tf:105", "Infrastructure/Modules/ALB/main.tf:14"] },
    { "id": "TB2", "name": "Public subnet (ALB) → private subnet (ECS tasks)", "kind": "network", "evidence": ["Infrastructure/Modules/Networking/main.tf:27", "Infrastructure/Modules/Networking/main.tf:39", "Infrastructure/main.tf:221"] },
    { "id": "TB3", "name": "ECS task → AWS managed services via IAM task role (DynamoDB/S3)", "kind": "trust", "evidence": ["Infrastructure/Modules/IAM/main.tf:306", "Infrastructure/Modules/IAM/main.tf:36"] },
    { "id": "TB4", "name": "CI/CD supply chain: GitHub → CodePipeline → CodeBuild → ECR → ECS", "kind": "cicd", "evidence": ["Infrastructure/Modules/CodePipeline/main.tf", "Infrastructure/Templates/buildspec.yml", "Infrastructure/Modules/CodeBuild/main.tf:22"] },
    { "id": "TB5", "name": "AWS account / region boundary", "kind": "region", "evidence": ["Infrastructure/main.tf:9", "Infrastructure/main.tf:28"] },
    { "id": "TB6", "name": "VPC perimeter (IGW / NAT egress to 0.0.0.0/0)", "kind": "network", "evidence": ["Infrastructure/Modules/Networking/main.tf:60", "Infrastructure/Modules/Networking/main.tf:91", "Infrastructure/Modules/Networking/main.tf:100"] }
  ],
  "external_deps": [
    { "id": "X1", "name": "GitHub source repository + OAuth personal access token", "tech": "GitHub v1 source, PAT", "evidence": ["Infrastructure/Modules/CodePipeline/main.tf:29", "README.md:92"], "manifest": null, "risk": "Long-lived PAT stored in local Terraform state and pipeline config; single-factor supply-chain trust anchor." },
    { "id": "X2", "name": "Server npm dependencies (aws-sdk, express, cors, swagger-*, artillery)", "tech": "npm", "evidence": ["Code/server/package.json", "Code/server/package-lock.json"], "manifest": "Code/server/package-lock.json", "risk": "aws-sdk v2 (maintenance mode); no lockfile integrity/SCA scanning in pipeline." },
    { "id": "X3", "name": "Client npm dependencies (vue 2, bootstrap-vue, axios)", "tech": "npm", "evidence": ["Code/client/package.json", "Code/client/package-lock.json"], "manifest": "Code/client/package-lock.json", "risk": "Vue 2 is end-of-life; no SCA scanning in pipeline." },
    { "id": "X4", "name": "Docker base images (public.ecr.aws bitnami/node:latest, nginx:latest)", "tech": "Public ECR container base images", "evidence": ["Code/server/Dockerfile:4", "Code/client/Dockerfile:13"], "manifest": null, "risk": "Unpinned :latest mutable tags; no digest pinning or image scanning — non-reproducible, supply-chain drift." },
    { "id": "X5", "name": "CodeBuild managed image aws/codebuild/standard:4.0", "tech": "AWS-managed CodeBuild image", "evidence": ["Infrastructure/Modules/CodeBuild/main.tf:20"], "manifest": null, "risk": "Outdated build image; privileged_mode enabled (Docker-in-Docker)." }
  ]
}
